{
  "$schema": "http://json-schema.org/draft-07/schema#",
  "$id": "concept.schema.json",
  "title": "Concept record",
  "description": "One concept a question family tests (SESSION 009 / SPEC-PYQ-002). A concept is the underlying idea, not the surface form; a family tests one concept, and a concept can underpin several families. It is an analysis of T2 evidence, never new evidence, and never T1_OFFICIAL. Validated by hand-written checks in tests/pyq/test_pyq_intelligence.py (D-0006).",
  "type": "object",
  "required": [
    "concept_id", "name", "subject", "description", "parent_concept_id",
    "family_ids", "standard_method_ids", "analysis_origin", "evidence_tier",
    "provenance", "verification_status"
  ],
  "properties": {
    "concept_id": {"type": "string", "pattern": "^CON-PYQ-[0-9]{4}$"},
    "name": {"type": "string", "minLength": 2},
    "subject": {"type": "string"},
    "description": {"type": "string", "minLength": 1, "description": "What the concept is, in plain language."},
    "parent_concept_id": {"type": ["string", "null"], "pattern": "^CON-PYQ-[0-9]{4}$", "description": "A broader concept this sits under, if any."},

    "family_ids": {"type": "array", "items": {"type": "string", "pattern": "^FAM-PYQ-[0-9]{4}$"}, "description": "Families that test this concept."},
    "standard_method_ids": {"type": "array", "items": {"type": "string", "pattern": "^MET-PYQ-[0-9]{4}$"}, "description": "Canonical methods that solve this concept."},

    "analysis_origin": {"enum": ["OBSERVED_STANDARD", "MODEL_DERIVED", "EXPERT_SOURCED"]},
    "evidence_tier": {"const": "T2_HISTORICAL_PYQ"},
    "provenance": {
      "type": "object",
      "required": ["source_document_ids"],
      "properties": {
        "source_document_ids": {"type": "array", "items": {"type": "string"}},
        "expert_source_ref": {"type": ["string", "null"], "description": "Required iff analysis_origin == EXPERT_SOURCED; not Instagram or YouTube."},
        "generated_at": {"type": ["string", "null"]}
      }
    },
    "verification_status": {"enum": ["VERIFIED", "UNVERIFIED", "DISPUTED", "REJECTED"]}
  },
  "invariants": [
    "a concept is grounded in at least one family, or is a LABELLED curriculum candidate; a concept with no family and no explicit candidate mark is not grounded",
    "analysis_origin == EXPERT_SOURCED  =>  provenance.expert_source_ref is non-null and is not an Instagram or YouTube URL",
    "a concept is never T1_OFFICIAL; it is an analysis over T2 evidence",
    "family_ids non-empty  =>  every listed id resolves to a real family record"
  ]
}
